{
  "Name": "All Action",
  "IsCombine": false,
  "LoopCount": 0,
  "RandomIntervalMs": 0,
  "RandomJitterPx": 0,
  "DefaultWindowTitle": "",
  "DefaultProcessName": "",
  "DefaultRelativeToWindow": false,
  "Steps": [
    {"Id":"1b854e7810834f86b52cc262a62845f9","Name":"Step","ActionType":0,"Enabled":true,"IsChecked":true,"StartX":228,"StartY":140,"EndX":0,"EndY":0,"HoldMs":10,"DelayMs":240,"RepeatCount":1,"ScrollStep":0,"KeyData":"Piano Tile","ColorHex":"#00FF00","Tolerance":10,"IfTrueStep":0,"IfFalseStep":0,"WindowTitle":"","ProcessName":"","RelativeToWindow":false,"Note":""},
    {"Id":"f1c76922abb34b81b4de3820e840088f","Name":"Step","ActionType":1,"Enabled":true,"IsChecked":true,"StartX":310,"StartY":141,"EndX":0,"EndY":0,"HoldMs":10,"DelayMs":240,"RepeatCount":1,"ScrollStep":0,"KeyData":"Piano Tile","ColorHex":"#00FF00","Tolerance":10,"IfTrueStep":0,"IfFalseStep":0,"WindowTitle":"","ProcessName":"","RelativeToWindow":false,"Note":""},
    {"Id":"0eeec133360b43b8b734d06381c0fbbf","Name":"Step","ActionType":2,"Enabled":true,"IsChecked":true,"StartX":386,"StartY":138,"EndX":0,"EndY":0,"HoldMs":10,"DelayMs":240,"RepeatCount":1,"ScrollStep":0,"KeyData":"Piano Tile","ColorHex":"#00FF00","Tolerance":10,"IfTrueStep":0,"IfFalseStep":0,"WindowTitle":"","ProcessName":"","RelativeToWindow":false,"Note":""},
    {"Id":"d4297a2854c64794a051691c5e302db9","Name":"Step","ActionType":3,"Enabled":true,"IsChecked":true,"StartX":476,"StartY":145,"EndX":0,"EndY":0,"HoldMs":10,"DelayMs":240,"RepeatCount":1,"ScrollStep":0,"KeyData":"Piano Tile","ColorHex":"#00FF00","Tolerance":10,"IfTrueStep":0,"IfFalseStep":0,"WindowTitle":"","ProcessName":"","RelativeToWindow":false,"Note":""},
    {"Id":"4b5cb35e4d194e4aa19695891da52411","Name":"Step","ActionType":4,"Enabled":true,"IsChecked":true,"StartX":229,"StartY":189,"EndX":299,"EndY":239,"HoldMs":500,"DelayMs":240,"RepeatCount":1,"ScrollStep":0,"KeyData":"Piano Tile","ColorHex":"#00FF00","Tolerance":10,"IfTrueStep":0,"IfFalseStep":0,"WindowTitle":"","ProcessName":"","RelativeToWindow":false,"Note":""},
    {"Id":"98fd39dc169344dc816279cbe24f64aa","Name":"Step","ActionType":5,"Enabled":true,"IsChecked":true,"StartX":0,"StartY":0,"EndX":0,"EndY":0,"HoldMs":10,"DelayMs":240,"RepeatCount":1,"ScrollStep":0,"KeyData":"Ctrl+C","ColorHex":"#00FF00","Tolerance":10,"IfTrueStep":0,"IfFalseStep":0,"WindowTitle":"","ProcessName":"","RelativeToWindow":false,"Note":""},
    {"Id":"81b808081b4945758923563a7f250ca6","Name":"Step","ActionType":6,"Enabled":true,"IsChecked":true,"StartX":0,"StartY":0,"EndX":0,"EndY":0,"HoldMs":100,"DelayMs":240,"RepeatCount":1,"ScrollStep":0,"KeyData":"Hello World","ColorHex":"#00FF00","Tolerance":10,"IfTrueStep":0,"IfFalseStep":0,"WindowTitle":"","ProcessName":"","RelativeToWindow":false,"Note":""},
    {"Id":"62c4b90f532e46e1b3b1647fb3b06b8b","Name":"Step","ActionType":7,"Enabled":true,"IsChecked":true,"StartX":0,"StartY":0,"EndX":0,"EndY":0,"HoldMs":1250,"DelayMs":250,"RepeatCount":1,"ScrollStep":0,"KeyData":"Piano Tile","ColorHex":"#00FF00","Tolerance":10,"IfTrueStep":0,"IfFalseStep":0,"WindowTitle":"","ProcessName":"","RelativeToWindow":false,"Note":""},
    {"Id":"959f01959fe74ae6a5beab0bb19febe6","Name":"Step","ActionType":8,"Enabled":true,"IsChecked":true,"StartX":390,"StartY":184,"EndX":0,"EndY":0,"HoldMs":1,"DelayMs":240,"RepeatCount":1,"ScrollStep":0,"KeyData":"Piano Tile","ColorHex":"#0A0116","Tolerance":10,"IfTrueStep":0,"IfFalseStep":0,"WindowTitle":"","ProcessName":"","RelativeToWindow":false,"Note":""},
    {"Id":"6a3aa1bf28d84196b2d3db668df2f4d7","Name":"Step","ActionType":9,"Enabled":true,"IsChecked":true,"StartX":478,"StartY":188,"EndX":0,"EndY":0,"HoldMs":1,"DelayMs":240,"RepeatCount":1,"ScrollStep":0,"KeyData":"Piano Tile","ColorHex":"#0E011B","Tolerance":10,"IfTrueStep":-2,"IfFalseStep":1,"WindowTitle":"","ProcessName":"","RelativeToWindow":false,"Note":""},
    {"Id":"b643e3bf3b7148f0889df85f8abc43d7","Name":"Step","ActionType":10,"Enabled":true,"IsChecked":true,"StartX":388,"StartY":231,"EndX":536,"EndY":268,"HoldMs":1,"DelayMs":240,"RepeatCount":1,"ScrollStep":0,"KeyData":"Piano Tile","ColorHex":"#120226","Tolerance":10,"IfTrueStep":-2,"IfFalseStep":0,"WindowTitle":"","ProcessName":"","RelativeToWindow":false,"Note":""},
    {"Id":"136ee5960d4b4afeafcd3486f1cf8a7e","Name":"Step","ActionType":11,"Enabled":true,"IsChecked":true,"StartX":390,"StartY":308,"EndX":0,"EndY":0,"HoldMs":1,"DelayMs":240,"RepeatCount":1,"ScrollStep":0,"KeyData":"Piano Tile","ColorHex":"#00FF00","Tolerance":10,"IfTrueStep":0,"IfFalseStep":0,"WindowTitle":"","ProcessName":"","RelativeToWindow":false,"Note":""},
    {"Id":"efab5d77de3d4a7ebd28dec8f1fc4de8","Name":"Step","ActionType":12,"Enabled":true,"IsChecked":true,"StartX":0,"StartY":0,"EndX":0,"EndY":0,"HoldMs":1,"DelayMs":240,"RepeatCount":1,"ScrollStep":0,"KeyData":"Piano Tile","ColorHex":"#00FF00","Tolerance":10,"IfTrueStep":-2,"IfFalseStep":0,"WindowTitle":"","ProcessName":"","RelativeToWindow":false,"Note":""}
  ]
}