{
  "Name": "Piano Tile",
  "IsCombine": false,
  "LoopCount": 0,
  "RandomIntervalMs": 0,
  "RandomJitterPx": 0,
  "DefaultWindowTitle": "Magic Tiles 3 | Play Online For Free On Magictiles.org - Google Chrome",
  "DefaultProcessName": "chrome",
  "DefaultRelativeToWindow": true,
  "Steps": [
    {"Id":"568df5d5c8bf4978800593296b7af2a0","Name":"Step 1","ActionType":9,"Enabled":true,"IsChecked":true,"StartX":689,"StartY":715,"EndX":0,"EndY":0,"HoldMs":1,"DelayMs":0,"RepeatCount":1,"ScrollStep":0,"KeyData":"Script 1","ColorHex":"#090A0B","Tolerance":10,"IfTrueStep":-2,"IfFalseStep":0,"WindowTitle":"Magic Tiles 3 | Play Online For Free On Magictiles.org - Google Chrome","ProcessName":"chrome","RelativeToWindow":true,"Note":""},
    {"Id":"1e867028c09444179e106f3991d5d950","Name":"Step","ActionType":9,"Enabled":true,"IsChecked":true,"StartX":749,"StartY":716,"EndX":0,"EndY":0,"HoldMs":1,"DelayMs":0,"RepeatCount":1,"ScrollStep":0,"KeyData":"Script 1","ColorHex":"#090A0B","Tolerance":10,"IfTrueStep":-2,"IfFalseStep":0,"WindowTitle":"Magic Tiles 3 | Play Online For Free On Magictiles.org - Google Chrome","ProcessName":"chrome","RelativeToWindow":true,"Note":""},
    {"Id":"2adf8bf305344196a8077e003f6a464a","Name":"Step","ActionType":9,"Enabled":true,"IsChecked":true,"StartX":825,"StartY":716,"EndX":0,"EndY":0,"HoldMs":1,"DelayMs":0,"RepeatCount":1,"ScrollStep":0,"KeyData":"Script 1","ColorHex":"#090A0B","Tolerance":10,"IfTrueStep":-2,"IfFalseStep":0,"WindowTitle":"Magic Tiles 3 | Play Online For Free On Magictiles.org - Google Chrome","ProcessName":"chrome","RelativeToWindow":true,"Note":""},
    {"Id":"a871a764d89e470295fce94a4b749c05","Name":"Step","ActionType":9,"Enabled":true,"IsChecked":true,"StartX":886,"StartY":718,"EndX":0,"EndY":0,"HoldMs":1,"DelayMs":0,"RepeatCount":1,"ScrollStep":0,"KeyData":"Script 1","ColorHex":"#090A0B","Tolerance":10,"IfTrueStep":-2,"IfFalseStep":0,"WindowTitle":"Magic Tiles 3 | Play Online For Free On Magictiles.org - Google Chrome","ProcessName":"chrome","RelativeToWindow":true,"Note":""}
  ]
}